{
  "schema": "kxm.assignment-result.v1",
  "projectId": "prj_01JPROJECT00000000000000000",
  "runId": "run_01JRUN00000000000000000000",
  "stepId": "implement",
  "stepAttempt": 1,
  "assignmentId": "assignment_01JASSIGNMENT00000000000",
  "attemptId": "attempt_01JATTEMPT0000000000000",
  "status": "passed",
  "outcome": "implemented",
  "summary": "Added single-flight token refresh and production-coupled regression coverage.",
  "evidenceRefs": [
    {
      "id": "evidence_01JEVIDENCE000000000000",
      "kind": "test-result",
      "hash": "sha256:5555555555555555555555555555555555555555555555555555555555555555",
      "status": "passed"
    }
  ],
  "repositoryOutputs": [
    {
      "repositoryId": "api",
      "baseCommit": "aaaaaaaaaaaaaaaaaaaaaaaaaaaaaaaaaaaaaaaa",
      "contentSnapshotHash": "sha256:3333333333333333333333333333333333333333333333333333333333333333",
      "outputCommit": "cccccccccccccccccccccccccccccccccccccccc",
      "changes": {
        "repositoryId": "api",
        "added": ["test/Auth/RefreshConcurrencyTest.cs"],
        "modified": ["src/Auth/RefreshService.cs"]
      }
    }
  ],
  "timing": {
    "startedAt": "2026-09-01T22:00:00.000Z",
    "finishedAt": "2026-09-01T22:12:10.000Z",
    "durationMs": 730000,
    "agentMs": 730000
  },
  "usage": {
    "inputTokens": 18200,
    "outputTokens": 3400,
    "cost": 1.42,
    "currency": "USD",
    "costKind": "estimated"
  }
}
